{
  "definitions": {
    "items": {
      "$id": "#/items",
      "type": [
        "object",
        "array"
      ],
      "title": "Generic container for items in a dataset",
      "description": "A JSON array or object property containing one or more items in a dataset or data structure within a dataset."
    }
  },
  "$schema": "http://json-schema.org/draft-07/schema#",
  "$id": "http://data.usgs.gov/property_registry/",
  "type": [
    "array",
    "object"
  ],
  "title": "FWS National Listing Workplan Species",
  "description": "A processed dataset of the FWS National Listing Workplan species from original source material. Includes the addition of properties to aid in name/identifier lookup from other sources.",
  "items": {
    "$ref": "#/definitions/items",
    "required": [
      "Guild",
      "Species Name (Common)",
      "Scientific Name",
      "Lead FWS Regional Office",
      "Proposed FWS Decision Timeframe (Fiscal Year)",
      "Range",
      "Bin",
      "ECOS Link",
      "ITIS TSN",
      "Lookup Name"
    ]
  },
    "properties": {
      "Guild": {
        "$id": "#/items/properties/Guild",
        "type": "string",
        "title": "Species Guild",
        "description": "A high level grouping of species into guilds. This property was added by USGS Ecosystems Mission Area staff to help organize the original FWS list.",
        "enum": [
          "Amphibians",
          "Birds",
          "Flowering Plants",
          "Insects",
          "Mammals",
          "Snails",
          "Bivalves",
          "Crustaceans",
          "Fishes",
          "Non-Flowering Plants",
          "Reptiles"
        ]
      },
      "Species Name (Common)": {
        "$id": "#/items/properties/Species Name (Common)",
        "type": "string",
        "title": "Species Common Name",
        "description": "A common (vernacular) name for the species.",
        "examples": [
          "Arizona toad"
        ]
      },
      "Scientific Name": {
        "$id": "#/items/properties/Scientific Name",
        "type": "string",
        "title": "Scientific Name",
        "description": "The scientific (latin) name for the species.",
        "examples": [
          "Bufo microscaphus microscaphus"
        ]
      },
      "Lead FWS Regional Office": {
        "$id": "#/items/properties/Lead FWS Regional Office",
        "type": "string",
        "title": "Lead FWS Regional Office",
        "description": "The FWS Regional Office with lead for the listing process.",
        "enum": [
          "Region 1 - Pacific (Northwest)",
          "Region 2 - Southwest",
          "Region 3 - Midwest",
          "Region 4 - Southeast",
          "Region 5 - Northeast",
          "Region 6 - Mountain-Prairie",
          "Region 7 - Alaska",
          "Region 8 - Pacific Southwest"
        ]
      },
      "Proposed FWS Decision Timeframe (Fiscal Year)": {
        "$id": "#/items/properties/Proposed FWS Decision Timeframe (Fiscal Year)",
        "type": "integer",
        "title": "Proposed fws decision timeframe (fiscal year)",
        "description": "The proposed time frame in which the FWS will seek to make a decision on listing.",
        "enum": [
          2023,
          2022,
          2021,
          2020,
          2017,
          2019,
          2018
        ]
      },
      "Range": {
        "$id": "#/items/properties/Range",
        "type": "string",
        "title": "Geographic Range",
        "description": "A list of US states and other areas considered to be in the range of the species.",
        "examples": [
          "AZ, CA, NM, NV, UT"
        ]
      },
      "Bin": {
        "$id": "#/items/properties/Bin",
        "type": [
          "null",
          "string"
        ],
        "title": "Bin",
        "description": "A text value for a listing workplan bin assignment.",
        "enum": [
          null,
          "LPN 9",
          "LPN 2",
          "LPN 8",
          "LPN 6",
          "LPN 5",
          "LPN 3"
        ]
      },
      "ECOS Link": {
        "$id": "#/items/properties/ECOS Link",
        "type": [
          "null",
          "string"
        ],
        "title": "ECOS Link",
        "description": "Web link to a species information page in the USFWS Ecological Conservation Online System. It is not clear when or by whom this property was added to original source material.",
        "examples": [
          "https://ecos.fws.gov/ecp/species/2077"
        ]
      },
      "ITIS TSN": {
        "$id": "#/items/properties/ITIS TSN",
        "type": [
          "string",
          "null"
        ],
        "title": "ITIS TSN",
        "description": "The ITIS Taxonomic Serial Number added into the data from processing steps.",
        "examples": [
          "207135"
        ]
      },
      "Lookup Name": {
        "$id": "#/items/properties/Lookup Name",
        "type": "string",
        "title": "Lookup Name",
        "description": "The most appropriate name to use in species lookup based on processing steps. In some cases, an original name string contained species identification information that would hinder rather than help in API searches, and these were cut down to the best name string available.",
        "examples": [
          "Bufo microscaphus microscaphus"
        ]
      },
      "Valid ITIS Scientific Name": {
        "$id": "#/items/properties/Valid ITIS Scientific Name",
        "type": "string",
        "title": "Valid ITIS scientific Name",
        "description": "Based on previous processing steps, when applicable the valid scientific name according to ITIS was added to serve as an additional name in searches.",
        "examples": [
          "Anaxyrus microscaphus"
        ]
      },
      "Valid ITIS TSN": {
        "$id": "#/items/properties/Valid ITIS TSN",
        "type": "string",
        "title": "Valid ITIS TSN",
        "description": "Based on previous processing steps, when applicable the valid TSN  according to ITIS was added.",
        "examples": [
          "773525"
        ]
      }
    }
  }