[{"Guild": "Amphibians", "Species Name (Common)": "Cascade torrent salamander", "Scientific Name": "Rhyacotriton cascadae", "Lead FWS Regional Office": "Region 1 - Pacific (Northwest)", "Proposed FWS Decision Timeframe (Fiscal Year)": 2023, "Range": "OR, WA", "Bin": null, "Lookup Name": "Rhyacotriton cascadae", "ECOS Link": "https://ecos.fws.gov/ecp/species/1375", "ITIS TSN": "550250"}, {"Guild": "Amphibians", "Species Name (Common)": "Cascades frog", "Scientific Name": "Rana cascadae", "Lead FWS Regional Office": "Region 1 - Pacific (Northwest)", "Proposed FWS Decision Timeframe (Fiscal Year)": 2022, "Range": "OR, WA", "Bin": null, "Lookup Name": "Rana cascadae", "ECOS Link": "https://ecos.fws.gov/ecp/species/7827", "ITIS TSN": "173450"}, {"Guild": "Amphibians", "Species Name (Common)": "Columbia torrent salamander", "Scientific Name": "Rhyacotriton kezeri", "Lead FWS Regional Office": "Region 1 - Pacific (Northwest)", "Proposed FWS Decision Timeframe (Fiscal Year)": 2021, "Range": "OR, WA", "Bin": null, "Lookup Name": "Rhyacotriton kezeri", "ECOS Link": "https://ecos.fws.gov/ecp/species/3376", "ITIS TSN": "550251"}, {"Guild": "Amphibians", "Species Name (Common)": "Oregon slender salamander", "Scientific Name": "Batrachoseps wrighti", "Lead FWS Regional Office": "Region 1 - Pacific (Northwest)", "Proposed FWS Decision Timeframe (Fiscal Year)": 2020, "Range": "OR, WA", "Bin": null, "Lookup Name": "Batrachoseps wrighti", "ECOS Link": "https://ecos.fws.gov/ecp/species/913", "ITIS TSN": "173712"}, {"Guild": "Birds", "Species Name (Common)": "Mt. Rainier white-tailed ptarmigan", "Scientific Name": "Lagopus leucura rainierensis", "Lead FWS Regional Office": "Region 1 - Pacific (Northwest)", "Proposed FWS Decision Timeframe (Fiscal Year)": 2020, "Range": "WA", "Bin": null, "Lookup Name": "Lagopus leucura rainierensis", "ECOS Link": "https://ecos.fws.gov/ecp/species/9234", "ITIS TSN": "677706"}, {"Guild": "Birds", "Species Name (Common)": "northern spotted owl", "Scientific Name": "Strix occidentalis caurina", "Lead FWS Regional Office": "Region 1 - Pacific (Northwest)", "Proposed FWS Decision Timeframe (Fiscal Year)": 2017, "Range": "CA, OR, WA", "Bin": null, "Lookup Name": "Strix occidentalis caurina", "ECOS Link": "https://ecos.fws.gov/ecp/species/1123", "ITIS TSN": "177926"}, {"Guild": "Birds", "Species Name (Common)": "Tinian monarch", "Scientific Name": "Monarcha takatsukasae", "Lead FWS Regional Office": "Region 1 - Pacific (Northwest)", "Proposed FWS Decision Timeframe (Fiscal Year)": 2017, "Range": "MP", "Bin": null, "Lookup Name": "Monarcha takatsukasae", "ECOS Link": "https://ecos.fws.gov/ecp/species/6613", "ITIS TSN": "178684"}, {"Guild": "Birds", "Species Name (Common)": "tufted puffin", "Scientific Name": "Fratercula cirrhata", "Lead FWS Regional Office": "Region 1 - Pacific (Northwest)", "Proposed FWS Decision Timeframe (Fiscal Year)": 2019, "Range": "CA, OR, WA", "Bin": null, "Lookup Name": "Fratercula cirrhata", "ECOS Link": "https://ecos.fws.gov/ecp/species/430", "ITIS TSN": "177032"}, {"Guild": "Flowering Plants", "Species Name (Common)": "mountain blue-eyed grass", "Scientific Name": "Sisyrinchium sarmentosum", "Lead FWS Regional Office": "Region 1 - Pacific (Northwest)", "Proposed FWS Decision Timeframe (Fiscal Year)": 2018, "Range": "WA", "Bin": null, "Lookup Name": "Sisyrinchium sarmentosum", "ECOS Link": "https://ecos.fws.gov/ecp/species/5588", "ITIS TSN": "43273"}, {"Guild": "Flowering Plants", "Species Name (Common)": "sand dune (or silvery) phacelia", "Scientific Name": "Phacelia argentea", "Lead FWS Regional Office": "Region 1 - Pacific (Northwest)", "Proposed FWS Decision Timeframe (Fiscal Year)": 2021, "Range": "OR", "Bin": null, "Lookup Name": "Phacelia argentea", "ECOS Link": "https://ecos.fws.gov/ecp/species/599", "ITIS TSN": "31454"}, {"Guild": "Insects", "Species Name (Common)": "Franklin's bumblebee", "Scientific Name": "Bombus franklini", "Lead FWS Regional Office": "Region 1 - Pacific (Northwest)", "Proposed FWS Decision Timeframe (Fiscal Year)": 2018, "Range": "OR", "Bin": null, "Lookup Name": "Bombus franklini", "ECOS Link": "https://ecos.fws.gov/ecp/species/7022", "ITIS TSN": "714804"}, {"Guild": "Insects", "Species Name (Common)": "Island marble butterfly", "Scientific Name": "Euchloe ausonides insulanus", "Lead FWS Regional Office": "Region 1 - Pacific (Northwest)", "Proposed FWS Decision Timeframe (Fiscal Year)": 2017, "Range": "WA", "Bin": "LPN 3", "Lookup Name": "Euchloe ausonides insulanus", "ECOS Link": null, "ITIS TSN": null}, {"Guild": "Insects", "Species Name (Common)": "sand verbena moth", "Scientific Name": "Copablepharon fuscum", "Lead FWS Regional Office": "Region 1 - Pacific (Northwest)", "Proposed FWS Decision Timeframe (Fiscal Year)": 2019, "Range": "WA", "Bin": null, "Lookup Name": "Copablepharon fuscum", "ECOS Link": "https://ecos.fws.gov/ecp/species/9053", "ITIS TSN": null}, {"Guild": "Mammals", "Species Name (Common)": "red tree vole", "Scientific Name": "Arborimus longicaudus", "Lead FWS Regional Office": "Region 1 - Pacific (Northwest)", "Proposed FWS Decision Timeframe (Fiscal Year)": 2019, "Range": "OR", "Bin": "LPN 9", "Lookup Name": "Arborimus longicaudus", "ECOS Link": "https://ecos.fws.gov/ecp0/profile/speciesProfile?spcode=A0J3", "ITIS TSN": "180353"}, {"Guild": "Snails", "Species Name (Common)": "Burrington (keeled) jumping-slug", "Scientific Name": "Hemphillia burringtoni", "Lead FWS Regional Office": "Region 1 - Pacific (Northwest)", "Proposed FWS Decision Timeframe (Fiscal Year)": 2021, "Range": "OR, WA", "Bin": null, "Lookup Name": "Hemphillia burringtoni", "ECOS Link": "https://ecos.fws.gov/ecp/species/8641", "ITIS TSN": "77089"}, {"Guild": "Snails", "Species Name (Common)": "Chelan mountain snail", "Scientific Name": "Oreohelix n. sp. 1", "Lead FWS Regional Office": "Region 1 - Pacific (Northwest)", "Proposed FWS Decision Timeframe (Fiscal Year)": 2023, "Range": "WA", "Bin": null, "Lookup Name": "Oreohelix", "ECOS Link": null, "ITIS TSN": null}, {"Guild": "Snails", "Species Name (Common)": "Columbia Oregonian snail", "Scientific Name": "Cryptomastix hendersoni", "Lead FWS Regional Office": "Region 1 - Pacific (Northwest)", "Proposed FWS Decision Timeframe (Fiscal Year)": 2022, "Range": "OR, WA", "Bin": null, "Lookup Name": "Cryptomastix hendersoni", "ECOS Link": "https://ecos.fws.gov/ecp/species/8598", "ITIS TSN": "77509"}, {"Guild": "Snails", "Species Name (Common)": "Dalles sideband snail", "Scientific Name": "Monadenia fidelis minor", "Lead FWS Regional Office": "Region 1 - Pacific (Northwest)", "Proposed FWS Decision Timeframe (Fiscal Year)": 2021, "Range": "OR, WA", "Bin": null, "Lookup Name": "Monadenia fidelis minor", "ECOS Link": "https://ecos.fws.gov/ecp/species/4369", "ITIS TSN": null}, {"Guild": "Snails", "Species Name (Common)": "evening fieldslug", "Scientific Name": "Deroceras hesperium", "Lead FWS Regional Office": "Region 1 - Pacific (Northwest)", "Proposed FWS Decision Timeframe (Fiscal Year)": 2022, "Range": "OR, WA", "Bin": null, "Lookup Name": "Deroceras hesperium", "ECOS Link": "https://ecos.fws.gov/ecp/species/8642", "ITIS TSN": "77303"}, {"Guild": "Snails", "Species Name (Common)": "Hoko vertigo", "Scientific Name": "Vertigo sp.", "Lead FWS Regional Office": "Region 1 - Pacific (Northwest)", "Proposed FWS Decision Timeframe (Fiscal Year)": 2023, "Range": "WA", "Bin": null, "Lookup Name": "Vertigo", "ECOS Link": null, "ITIS TSN": null}, {"Guild": "Snails", "Species Name (Common)": "Puget Oregonian snail", "Scientific Name": "Cryptomastix devia", "Lead FWS Regional Office": "Region 1 - Pacific (Northwest)", "Proposed FWS Decision Timeframe (Fiscal Year)": 2020, "Range": "OR, WA", "Bin": null, "Lookup Name": "Cryptomastix devia", "ECOS Link": "https://ecos.fws.gov/ecp/species/294", "ITIS TSN": "77506"}, {"Guild": "Amphibians", "Species Name (Common)": "Arizona toad", "Scientific Name": "Bufo microscaphus microscaphus", "Lead FWS Regional Office": "Region 2 - Southwest", "Proposed FWS Decision Timeframe (Fiscal Year)": 2022, "Range": "AZ, CA, NM, NV, UT", "Bin": null, "Lookup Name": "Bufo microscaphus microscaphus", "ECOS Link": "https://ecos.fws.gov/ecp/species/2077", "ITIS TSN": "207135", "Valid ITIS Scientific Name": "Anaxyrus microscaphus", "Valid ITIS TSN": "773525"}, {"Guild": "Amphibians", "Species Name (Common)": "Blanco blind salamander", "Scientific Name": "Eurycea robusta", "Lead FWS Regional Office": "Region 2 - Southwest", "Proposed FWS Decision Timeframe (Fiscal Year)": 2021, "Range": "TX", "Bin": null, "Lookup Name": "Eurycea robusta", "ECOS Link": "https://ecos.fws.gov/ecp/species/29", "ITIS TSN": "586344"}, {"Guild": "Amphibians", "Species Name (Common)": "Cascade Caverns salamander", "Scientific Name": "Eurycea latitans", "Lead FWS Regional Office": "Region 2 - Southwest", "Proposed FWS Decision Timeframe (Fiscal Year)": 2021, "Range": "TX", "Bin": null, "Lookup Name": "Eurycea latitans", "ECOS Link": "https://ecos.fws.gov/ecp/species/4624", "ITIS TSN": "208320"}, {"Guild": "Amphibians", "Species Name (Common)": "Comal blind salamander", "Scientific Name": "Eurycea tridentifera", "Lead FWS Regional Office": "Region 2 - Southwest", "Proposed FWS Decision Timeframe (Fiscal Year)": 2021, "Range": "TX", "Bin": null, "Lookup Name": "Eurycea tridentifera", "ECOS Link": "https://ecos.fws.gov/ecp/species/2890", "ITIS TSN": "173696"}, {"Guild": "Amphibians", "Species Name (Common)": "Comal Springs salamander", "Scientific Name": "Eurycea sp.", "Lead FWS Regional Office": "Region 2 - Southwest", "Proposed FWS Decision Timeframe (Fiscal Year)": 2021, "Range": "TX", "Bin": null, "Lookup Name": "Eurycea", "ECOS Link": null, "ITIS TSN": null}, {"Guild": "Amphibians", "Species Name (Common)": "Texas salamander", "Scientific Name": "Eurycea nana", "Lead FWS Regional Office": "Region 2 - Southwest", "Proposed FWS Decision Timeframe (Fiscal Year)": 2021, "Range": "TX", "Bin": null, "Lookup Name": "Eurycea nana", "ECOS L